{"$id":"https://surfaces.dev/schemas/spectrum-switch-catalog/spectrum-switch-source-addendum-lock.v0.schema.json","$schema":"https://json-schema.org/draft/2020-12/schema","additionalProperties":false,"properties":{"packageIntegrity":{"const":"sha512-mSdmQn6fNEzKVo6W5xS4gO1EXCpC4ojiEm3GqTlSjhh26lC9siMgQSWi33ODvWe8ssfrxXX0unzVnL5VBt4+CA=="},"packageName":{"const":"@adobe/spectrum-design-data"},"packageRoot":{"const":"npm/@adobe/spectrum-design-data/0.7.0/package"},"packageTarball":{"const":"https://registry.npmjs.org/@adobe/spectrum-design-data/-/spectrum-design-data-0.7.0.tgz"},"packageVersion":{"const":"0.7.0"},"provenance":{"additionalProperties":false,"properties":{"generator":{"const":"surfaces-spectrum-switch-source-addendum-review"},"sourceRefs":{"const":["https://registry.npmjs.org/@adobe/spectrum-design-data/-/spectrum-design-data-0.7.0.tgz","spectrum-design-data://npm/@adobe/spectrum-design-data@0.7.0/package/components/switch.json#"]}},"required":["generator","sourceRefs"],"type":"object"},"reviewVerification":{"additionalProperties":false,"properties":{"checks":{"const":["npm-sha512-sri","tarball-sha256","selected-file-raw-sha256"]},"method":{"const":"review-time-tarball-verification"},"ordinaryMaterialization":{"const":"local-lock-conformance-only"},"verifiedAt":{"const":"2026-07-19T00:00:00.000Z"}},"required":["method","verifiedAt","checks","ordinaryMaterialization"],"type":"object"},"schemaId":{"const":"spectrum-switch-source-addendum-lock.v0"},"selectedFiles":{"items":false,"maxItems":1,"minItems":1,"prefixItems":[{"additionalProperties":false,"properties":{"hashAlgorithm":{"const":"sha256"},"packagePath":{"const":"components/switch.json"},"sha256":{"const":"f71fca208251775638f52f9b6dfefc19104b17119512f6c3ae491da3c684b512"}},"required":["packagePath","hashAlgorithm","sha256"],"type":"object"}],"type":"array"},"tarballHashAlgorithm":{"const":"sha256"},"tarballSha256":{"const":"12db4dd64e7ad0c0c6cadec7c2f8e24a8d819d1f3badb7d871fbfbfc99ffdff0"},"version":{"const":"0.0.0"}},"required":["schemaId","version","packageName","packageVersion","packageTarball","packageIntegrity","tarballHashAlgorithm","tarballSha256","packageRoot","selectedFiles","reviewVerification","provenance"],"type":"object"}